yemek_id,yemek_adi,kalori (kcal),protein (g),karbonhidrat (g),yag (g),porsiyon_turu,minimum_porsiyon_boyutu,porsiyon_artıs_birimi,porsiyon_metrik_türü,porsiyon_metrik,ana_bilesenler,tarif,maksimum_porsiyon
1,Yumurtalı Peynirli Ekmek,169.0,8.0,14.0,9.0,dilim,1.0,1.0,gram,60,"yumurta, beyaz peynir, ekmek","Yumurtayı çırpın, içerisine rendelenmiş beyaz peynir ekleyin. Karışımı ekmek diliminin üzerine dökün ve fırında pişirin.",10.0
2,Domates,11.47,0.48,2.14,0.11,adet,0.5,0.5,gram,110,domates,"Domatesleri yıkayın, dilimleyin ve salatalarda veya yemeklerde kullanın. Çiğ olarak tüketilebilir.",2.5
3,Siyah Zeytin,5.04,0.03,0.24,0.44,adet,5.0,1.0,gram,4,"siyah zeytin, tuz",Siyah zeytinleri yıkayıp dilediğiniz şekilde servis edin.,25.0
4,Tavuklu Sebzeli Bulgur Pilavı,28.07,1.94,3.48,0.71,yemek kaşığı,3.0,1.0,gram,20,"tavuk, bulgur, sebzeler, baharatlar","Tavuk parçalarını kavurun, üzerine doğranmış sebzeleri ekleyin. Bulgur, su ve baharatları ilave ederek pişirin.",21.0
5,Ayran,73.52,3.96,5.42,4.0,su bardağı,1.0,1.0,ml,200,"yoğurt, su, tuz",Bir kase yoğurdu su ve tuz ile karıştırarak ayran elde edin.,5.0
6,Kıymalı Patates Yemeği,33.5,1.7,3.3,1.5,yemek kaşığı,4.0,1.0,gram,30,"kıyma, patates, soğan, domates salçası, sıvı yağ","Önce soğanı doğrayıp sıvı yağda kavurun. Ardından kıymayı ekleyip pişirin. Salça, doğranmış patates ve suyu ekleyip pişene kadar kaynatın.",20.0
7,Cacık,59.7,3.05,4.72,3.18,kase,1.0,1.0,gram,150,"yoğurt, salatalık, su, zeytinyağı, sarımsak, nane","Yoğurdu su ile kıvamına getirin, rendelenmiş salatalık ve ezilmiş sarımsak ekleyin. Üzerine zeytinyağı gezdirip nane ile süsleyin.",5.0
8,Süt,123.4,6.6,9.4,6.6,su bardağı,1.0,1.0,ml,200,süt,Bir kaseye süt dökün ve içmeye hazır hale getirin.,6.0
9,Yulaf Ezmesi,11.43,0.5,1.75,0.27,yemek kaşığı,4.0,1.0,gram,15,"yulaf, su veya süt, tuz","Yulaf ezmesini su veya süt ile pişirin, istenirse biraz tuz ekleyin.",20.0
10,Muz,88.86,0.98,20.56,0.3,adet,1.0,1.0,gram,90,muz,Muz kabuğunu soyup doğrudan tüketebilirsiniz.,5.0
11,Sebzeli Tavuk Sote,55.900000000000006,3.2,2.0,3.9,yemek kaşığı,4.0,1.0,gram,30,"tavuk göğsü, kırmızı biber, yeşil biber, soğan, domates",Tavuk göğsünü jülyen doğrayın. Soğan ve biberleri doğrayarak tavada soteleyin. Tavukları ekleyip pişirin. Domatesleri ekleyip kısa süre pişirdikten sonra servis edin.,20.0
12,Yoğurt,27.78,1.56,2.1,1.46,yemek kaşığı,1.0,1.0,ml,45,"süt, maya","Süt kaynatılır ve 40-45 dereceye kadar soğutulur. Maya eklenip karıştırılır, mayalanması için sıcak bir yerde bekletilir.",20.0
13,Nohutlu Yeşil Mercimek Yemeği,30.06,1.8,4.05,0.74,yemek kaşığı,4.0,1.0,gram,30,"nohut, yeşil mercimek, soğan, domates, zeytinyağı","Nohut ve yeşil mercimek haşlanır. Soğan ve domates zeytinyağında kavrulur. Haşlanan baklagiller eklenir, baharatlarla tatlandırılır ve kısık ateşte pişirilir.",20.0
14,Şalgam Suyu,14.580000000000002,1.03,2.12,0.22,su bardağı,1.0,1.0,ml,200,"şalgam, su, tuz, un, havuç, kırmızı pancar","Şalgam, pancar ve havuçlar doğranarak su, tuz ve un ile fermente edilir.",4.0
15,Tam Buğday Ekmeği,31.52,1.55,5.34,0.44,dilim,0.5,0.5,gram,25,"tam buğday unu, su, maya, tuz","Tam buğday unu, su, maya ve tuzu karıştırarak hamur yapın. Hamuru mayalandırın, şekil verin ve pişirin.",15.0
16,Beyaz Peynir,123.6,2.7,1.2,12.0,dilim,1.0,1.0,gram,30,"süt, peynir mayası, tuz","Süt, peynir mayası ve tuz karıştırılarak, peynir altı suyu ayrılana kadar bekletilir. Ardından kalıplara dökülüp, olgunlaşması için dinlendirilir.",6.0
17,Yeşil Zeytin,6.29,0.05,0.15,0.61,adet,5.0,1.0,gram,5,"yeşil zeytin, tuz, su",Yeşil zeytinleri sudan geçirip çekirdeklerini çıkarın ve istenirse doğrayarak servis edin.,25.0
18,Tavuklu Beğendi,26.4,3.3,0.6,1.2,yemek kaşığı,4.0,1.0,gram,30,"tavuk, patlıcan, un, süt, tereyağı, domates","Tavuklar sotelenir. Patlıcan közlenir ve un, tereyağı, süt ile beğendi hazırlanır. Beğendi üzerine tavuklar eklenir, domates sos ile servis edilir.",20.0
19,Kırmızı Biber Dolması,323.77,3.88,34.92,18.73,adet,1.0,1.0,gram,240,"kırmızı biber, pirinç, kıyma, domates, soğan","Kırmızı biberlerin içi temizlenir ve pirinç, kıyma, doğranmış soğan, domates ile hazırlanan iç harcıyla doldurulur. Üzerine sos dökülüp fırında pişirilir.",5.0
20,Yumurtalı Ispanak,17.57,1.22,0.36,1.25,yemek kaşığı,4.0,1.0,gram,30,"ıspanak, yumurta, zeytinyağı, soğan",Ispanakları doğrayın ve zeytinyağında soğanla kavurun. Üzerine yumurta kırın ve pişene kadar karıştırın.,20.0
21,Etli Pirinç Pilavı,27.98,1.1,4.32,0.7,yemek kaşığı,3.0,1.0,gram,20,"pirinç, kuşbaşı et, tereyağı, su veya et suyu, tuz","Kuşbaşı et tereyağında kavrulur, pirinç eklenerek kavurmaya devam edilir. Üzerine su veya et suyu eklenip pişirilir.",21.0
22,Yaprak Sarma,31.92,1.11,5.88,0.44,adet,3.0,1.0,gram,33,"asma yaprağı, pirinç, soğan, zeytinyağı","Asma yaprakları haşlanır ve iç harcı için pirinç, soğan ve baharatlar karıştırılır. Yapraklar iç harçla doldurulup sarılır ve tencereye dizilir. Üzerine zeytinyağı ve limon suyu eklenip pişirilir.",15.0
23,Kaşar Peyniri,107.30000000000001,8.1,0.77,7.98,dilim,1.0,1.0,gram,30,"süt, maya, tuz","Pastörize süt, peynir mayası ve tuz kullanılarak yapılan kaşar peyniri, olgunlaştırıldıktan sonra dilimlenerek servis edilir.",5.0
24,Mantı,125.06,3.09,22.28,2.62,kase,0.5,0.5,gram,150,"un, kıyma, yoğurt, tereyağı","Un, tuz ve su ile hamur hazırlanır, küçük parçalar halinde açılır. İçine kıymalı harç konulup kapatılır. Kaynar suda haşlandıktan sonra yoğurt ve tereyağlı sos ile servis edilir.",5.0
25,Karnıyarık,160.7,7.5,4.1,12.7,adet,1.0,1.0,gram,180,"patlıcan, kıyma, domates, biber, soğan, salça","Patlıcanlar ortadan kesilip kızartılır. Kıyma, soğan, biber ve salça kavrularak iç harcı hazırlanır. Patlıcanların içine harç doldurulur, domates dilimleri ile süslenir ve fırında pişirilir.",5.0
26,Bulgur Pilavı,22.92,0.56,3.64,0.68,yemek kaşığı,3.0,1.0,gram,20,"bulgur, soğan, biber, salça, zeytinyağı","Bulguru zeytinyağında kavrulmuş soğan ve biberle karıştır, salça ekle, su ilave ederek pişir.",21.0
27,Yumurtalı Kabak,19.72,1.1,0.59,1.44,yemek kaşığı,4.0,1.0,gram,25,"kabak, yumurta, zeytinyağı, soğan",Kabakları rendeleyin ve soğanla birlikte zeytinyağında kavurun. Yumurtaları ekleyip karıştırarak pişirin.,20.0
28,Tavuklu Makarna,30.659999999999997,1.77,2.34,1.58,yemek kaşığı,3.0,1.0,gram,25,"makarna, tavuk göğsü, zeytinyağı, domates sosu, baharatlar","Makarna haşlanır, tavuk göğsü küp şeklinde doğranır ve zeytinyağında sotelenir. Üzerine domates sosu ve baharatlar eklenerek karıştırılır.",21.0
29,Kıymalı Pırasa,14.52,0.91,0.74,0.88,yemek kaşığı,4.0,1.0,gram,25,"pırasa, kıyma, zeytinyağı, soğan, salça","Kıyma ve soğan zeytinyağında kavrulur, ardından doğranmış pırasa eklenir. Salça ve baharatlar ilave edilip su eklenir ve pişirilir.",20.0
30,Etli Kuru Fasulye,28.28,1.81,2.65,1.16,yemek kaşığı,4.0,1.0,gram,20,"kuru fasulye, dana eti, domates salçası, soğan, sıvı yağ",Kuru fasulyeleri bir gece önceden ıslatın. Tencereye sıvı yağı ekleyip doğranmış soğanları kavurun. Kuşbaşı doğranmış eti ekleyip rengi dönene kadar pişirin. Domates salçasını ekleyip kavurun. Islanmış fasulyeleri ve yeterince suyu ekleyip pişirin.,20.0
31,Tavuklu Bezelye Yemeği,13.669999999999998,1.52,0.84,0.47,yemek kaşığı,4.0,1.0,gram,20,"tavuk göğsü, bezelye, soğan, domates, havuç",Tavukları küp şeklinde doğrayın ve soğanla kavurun. Doğranmış havuçları ekleyip birkaç dakika pişirin. Ardından bezelye ve domatesi ekleyin. Baharatlar ve su ilave edip kısık ateşte pişirin.,20.0
32,Yağsız beyaz peynir,55.5,7.5,1.65,2.1,dilim,1.0,1.0,gram,30,"yağsız süt, peynir mayası, tuz",Yağsız süt ve peynir mayası ile hazırlanan karışımın kesilmesi ve ardından preslenmesi ile elde edilen yağsız beyaz peynir.,5.0
33,Yeşil çay,0.0,0.0,0.0,0.0,fincan,1.0,1.0,ml,200,"yeşil çay yaprağı, su","Bir fincan sıcak suya bir tatlı kaşığı yeşil çay yaprağı ekleyin, 3-5 dakika demleyin ve süzerek servis edin.",4.0
35,Kıvırcık salata,34.5,0.85,4.4,1.5,kase,1.0,0.5,gram,150,"kıvırcık salata, domates, salatalık, limon suyu, zeytinyağı","Kıvırcık salatayı yıkayıp doğrayın, domates ve salatalıkla karıştırın. Üzerine limon suyu ve zeytinyağı ekleyerek servis edin.",3.0
36,Orman kebabı,40.28,2.84,1.38,2.6,yemek kaşığı,4.0,1.0,gram,30,"kuzu eti, patates, havuç, bezelye, soğan, biber, domates","Kuzu eti parçaları, soğan ve biber ile kavrulur. Ardından küp doğranmış havuç, patates ve bezelye eklenir. Domates ilave edilerek baharatlarla tatlandırılır ve kısık ateşte pişirilir.",20.0
37,Mevsim salatası,56.96,2.55,7.28,1.96,kase,1.0,1.0,gram,190,"marul, domates, salatalık, havuç, limon suyu, zeytinyağı","Marul, domates, salatalık ve havuç doğranır. Üzerine limon suyu ve zeytinyağı eklenerek karıştırılır.",4.0
38,Meyve ,80.0,0.0,20.0,0.0,adet,1.0,1.0,gram,150,mevsim meyvesi,1 porsiyon orta boyutta mevsim meyvesini doğrayıp servis edelim.,6.0
39,Fındık,80.77,1.79,2.0,7.29,avuç,0.5,0.5,gram,30,fındık,Fındıkları kavurarak veya çiğ olarak tüketebilirsiniz.,4.0
40,Mercimek çorbası,101.7,7.7,10.3,3.3,kase,1.0,1.0,ml,200,"mercimek, soğan, havuç, patates, su, zeytinyağı","Mercimek, soğan, havuç ve patatesi doğrayıp suda haşlayın. Zeytinyağını ekleyip blenderdan geçirin ve baharatlarla tatlandırın.",5.0
41,Fırında kıymalı patates,230.62,10.78,26.4,9.1,porsiyon,4.0,1.0,gram,300,"patates, kıyma, soğan, domates salçası, zeytinyağı","Patatesler dilimlenir ve tepsiye dizilir; üzerine kavrulmuş kıyma, soğan ve salça karışımı eklenir; fırında pişirilir.",5.0
42,Izgara levrek,138.1,31.6,0.0,1.3,adet,1.0,1.0,gram,150,"levrek, zeytinyağı, limon","Levrek filetolarını zeytinyağı, tuz ve karabiberle marine edin. Izgarada her iki tarafını da 7-8 dakika pişirin. Limon suyu ile servis edin.",5.0
43,Zeytinyağlı fasulye,11.49,0.45,1.68,0.33,yemek kaşığı,4.0,1.0,gram,20,"taze fasulye, zeytinyağı, domates, soğan","Taze fasulyeler ayıklanır ve yıkanır. Soğanlar kavrulur, domates ve fasulye eklenir. Zeytinyağı ve su ilave edilerek pişirilir.",20.0
44,Kinoa salatası,227.15000000000003,7.2,29.0,9.15,kase,0.5,0.5,gram,380,"kinoa, domates, salatalık, maydanoz, limon, zeytinyağı","Kinoayı haşlayın ve soğumaya bırakın. Doğranmış domates, salatalık, ve maydanozu ekleyin. Üzerine limon suyu ve zeytinyağı gezdirin, karıştırın.",4.0
45,Yumurta,69.4,6.28,0.36,4.76,adet,1.0,1.0,gram,50,yumurta,Yumurtayı haşlayın veya tavada pişirin.,10.0
46,Zeytin,6.29,0.05,0.15,0.61,adet,5.0,1.0,gram,5,"zeytin, tuz, zeytinyağı",Zeytinleri yıkayın ve servis tabağına alın. Üzerine zeytinyağı gezdirip tuz ekleyerek servis edin.,25.0
47,Tavuklu sebzeli noodle,250.5,11.0,19.0,14.5,kase,0.5,0.5,gram,275,"tavuk göğsü, noodle, brokoli, havuç, soya sosu",Tavukları küp küp doğrayın ve tavada soteleyin. Ardından doğranmış brokoli ve havuç ekleyin. Noodle'ları haşlayıp sebzelerle karıştırın. Soya sosu ekleyip birkaç dakika pişirin ve servis edin.,4.0
48,Etli yaprak sarması,31.92,1.11,5.88,0.44,adet,3.0,1.0,gram,33,"asma yaprağı, kıyma, pirinç, soğan, zeytinyağı","Kıyma, pirinç, doğranmış soğan, zeytinyağı ve baharatlarla iç harç hazırlanır. Asma yaprağına sarılarak tencereye dizilir ve kısık ateşte pişirilir.",25.0
49,Tavuklu sebzeli pilav,37.4,1.8,5.3,1.0,yemek kaşığı,3.0,1.0,gram,25,"tavuk göğsü, pirinç, havuç, bezelye, biber, soğan",Tavuk göğsünü küp şeklinde doğrayın ve yağda soteleyin. Doğranmış soğan ve biberi ekleyip kavurun. Pirinç ve doğranmış sebzeleri ekleyerek karıştırın. Üzerine su ekleyip pişmeye bırakın.,21.0
50,Izgara somon,122.0,13.0,1.75,7.0,dilim,0.5,0.5,gram,150,"somon, zeytinyağı, limon, tuz, karabiber","Somon dilimini zeytinyağı, limon suyu, tuz ve karabiberle marine edin. Önceden ısıtılmış ızgarada her iki tarafını da yaklaşık 4-5 dakika pişirin.",5.0
51,Zeytinyağlı enginar,145.42000000000002,4.96,20.28,4.94,adet,1.0,1.0,gram,200,"enginar, zeytinyağı, havuç, patates, bezelye","Enginarlar temizlenip limonlu suda bekletilir. Zeytinyağında soğan, havuç, patates ve bezelye kavrulur. Enginarlar eklenip üzerine su ve limon suyu ilave edilerek pişirilir.",5.0
52,Quinoa salatası,227.15000000000003,7.2,29.0,9.15,kase,0.5,0.5,gram,380,"kinoa, domates, salatalık, zeytinyağı, limon suyu, maydanoz","Kinoa haşlanır ve soğutulur. Doğranmış domates, salatalık ve maydanoz ile karıştırılır. Üzerine zeytinyağı ve limon suyu eklenerek servis edilir.",4.0
53,Laz böreği,454.60999999999996,6.19,69.46,16.89,dilim,1.0,0.5,gram,215,"un, süt, şeker, yumurta, tereyağı, nişasta","Laz böreği, ince açılmış yufkaların arasında muhallebi ve üzerine dökülen şerbetle hazırlanan bir tatlıdır. Yufkaların üstüne eritilmiş tereyağı sürülerek kat kat dizilir ve muhallebi eklenir. Fırında pişirilip şerbet dökülerek servis edilir.",5.0
54,Çilek,4.36,0.08,0.92,0.04,adet,1.0,1.0,gram,12,çilek,Çilekleri yıkayıp temizleyin ve doğrayarak taze servis edin.,30.0
55,Kıymalı Makarna,14.54,0.72,1.79,0.5,yemek kaşığı,3.0,1.0,gram,20,"makarna, kıyma, domates sosu, soğan, zeytinyağı",Makarna haşlanır. Soğanlar doğranır ve zeytinyağında kavrulur. Kıyma eklenir ve pişirilir. Domates sosu ilave edilir. Haşlanmış makarna ile karıştırılır.,21.0
56,Salata,34.5,0.85,4.4,1.5,kase,1.0,0.5,gram,150,"marul, domates, salatalık, zeytinyağı, limon","Marul, domates ve salatalığı doğrayın. Zeytinyağı ve limon suyu ile karıştırarak servis edin.",5.0
57,Kıymalı Ispanak Yemeği,11.04,0.74,0.67,0.6,yemek kaşığı,4.0,1.0,gram,15,"ıspanak, kıyma, soğan, zeytinyağı, salça","Soğanları zeytinyağında kavurun, kıymayı ekleyip pişirin. Salça ekleyip karıştırın. Ispanakları ekleyip kısık ateşte pişirin. Baharatlarla tatlandırın.",20.0
58,Pirinç Pilavı,34.64,0.49,5.47,1.2,yemek kaşığı,3.0,1.0,gram,30,"pirinç, su, tereyağı veya sıvı yağ, tuz","Pirinç yıkanır ve süzülür. Tereyağı veya sıvı yağ tencerede eritilir, pirinç eklenir ve kavrulur. Üzerine su ve tuz eklenip, kısık ateşte suyunu çekene kadar pişirilir.",21.0
59,Kaşarlı Makarna,38.8,1.3,4.8,1.6,yemek kaşığı,3.0,1.0,gram,25,"makarna, kaşar peyniri, tereyağı",Makarnayı haşlayın ve süzün. Tereyağını eritip makarnayı ekleyin. Rendelenmiş kaşar peynirini karıştırarak eriyene kadar pişirin.,21.0
60,Elma,69.0,0.3,16.5,0.2,adet,1.0,1.0,gram,120,elma,Elmayı yıkayın ve çekirdeklerini çıkararak dilimleyin. İsteğe bağlı olarak kabuğunu soyabilirsiniz.,5.0
61,Tavuklu Sebze Sote,49.900000000000006,5.0,1.4,2.7,yemek kaşığı,4.0,1.0,gram,30,"tavuk göğsü, kırmızı biber, kabak, soğan, sarımsak","Tavuk göğsünü küp şeklinde doğrayın ve yağda soteleyin. Üzerine doğranmış sebzeleri ekleyin. Tuz, karabiber ve isteğe bağlı baharatlarla tatlandırın. Sebzeler yumuşayana kadar pişirin.",20.0
62,Fırında Balık,162.6,36.6,0.0,1.8,adet,1.0,1.0,gram,200,"balık fileto, zeytinyağı, limon, sarımsak, baharatlar","Balık filetolarını zeytinyağı, limon suyu, ezilmiş sarımsak ve baharatlarla marine edin. 180 derece önceden ısıtılmış fırında 20-25 dakika pişirin.",5.0
63,Peynirli Omlet,206.24,12.46,1.3,16.8,adet,1.0,1.0,gram,100,"yumurta, peynir, tereyağı","Yumurtaları çırpın, tereyağında tavada pişirin ve peyniri ekleyin. Altın rengi olana kadar pişirin.",5.0
64,Çavdar Ekmeği,30.5,0.9,6.5,0.1,dilim,1.0,0.5,gram,30,"çavdar unu, su, maya, tuz","Çavdar ununu su, maya ve tuz ile karıştırarak hamur yapın, mayalanmaya bırakın ve ardından önceden ısıtılmış fırında pişirin.",10.0
65,Portakal,30.150000000000002,0.7,6.5,0.15,adet,0.5,0.5,gram,140,portakal,Portakalı soyun ve dilimleyerek tüketin.,4.0
66,Kırmızı Etli Yeşil Mercimek Yemeği,35.5,2.7,2.8,1.5,yemek kaşığı,4.0,1.0,gram,25,"yeşil mercimek, kırmızı et, soğan, domates salçası, zeytinyağı","Yeşil mercimekler haşlanır. Küp doğranmış kırmızı et tencereye alınıp kavrulur, ardından soğan ve salça eklenir. Haşlanmış mercimekler ve su eklenir, pişmeye bırakılır.",20.0
67,Patlıcanlı Kıyma Sote,19.700000000000003,1.2,0.8,1.3,yemek kaşığı,4.0,1.0,gram,30,"patlıcan, kıyma, soğan, domates","Patlıcanları küp şeklinde doğrayın ve kızartın. Soğanı doğrayıp kavurun, kıymayı ekleyin ve pişirin. Domatesleri ekleyin, ardından kızarmış patlıcanları katın. Bir süre daha pişirin ve servis yapın.",20.0
68,Tavuklu Brokoli Sote,19.95,3.5,0.7,0.35,yemek kaşığı,4.0,1.0,gram,30,"tavuk göğsü, brokoli, zeytinyağı, soya sosu, sarımsak","Tavuk parçalarını ve brokoliyi zeytinyağı ile soteleyin, üzerine sarımsak ve soya sosu ekleyerek pişirin.",20.0
69,Fırında Sebzeli Balık,162.6,36.6,0.0,1.8,adet,1.0,1.0,gram,200,"balık fileto, patates, havuç, kabak, zeytinyağı",Balık filetolarını doğranmış sebzelerle birlikte fırın tepsisine dizin. Üzerine zeytinyağı gezdirin ve baharat ekleyin. Önceden ısıtılmış 180°C fırında 30-35 dakika pişirin.,4.0
70,Etli Sebze Yemeği,29.299999999999997,1.6,1.45,1.9,yemek kaşığı,4.0,1.0,gram,30,"dana eti, patates, havuç, soğan, yeşil biber, domates","Dana eti küçük parçalar halinde doğranır ve tencereye alınır. Üzerine doğranmış soğan eklenip kavrulur. Ardından doğranmış patates, havuç, yeşil biber ve domates eklenir. Tuz ve baharatlar ilave edilip biraz su eklenerek kısık ateşte pişirilir.",20.0
71,Fırında Tavuk,113.5,26.8,0.0,0.7,tabak,0.5,0.5,gram,200,"tavuk göğsü, zeytinyağı, baharatlar","Tavuk göğsünü zeytinyağı ve baharatlarla marine edip, önceden ısıtılmış fırında 180 derecede 25-30 dakika pişirin.",4.0
72,Tavuklu Mantar Sote,19.17,2.19,1.05,0.69,yemek kaşığı,4.0,1.0,gram,30,"tavuk, mantar, soğan, sarımsak, biber","Tavukları küp şeklinde doğrayın ve bir tavada az yağ ile soteleyin. Üzerine doğranmış soğan, mantar ve biber ekleyin. Sarımsak ve baharatlarla tatlandırarak pişirin.",20.0
73,Ispanaklı Peynirli Omlet,119.70000000000002,8.5,1.4,8.9,adet,0.5,0.5,gram,200,"yumurta, ıspanak, beyaz peynir, zeytinyağı",Yumurtaları çırpın ve içine doğranmış ıspanak ve beyaz peyniri ekleyin. Zeytinyağını tavada ısıtın ve karışımı tavaya dökün. Omleti her iki tarafı da pişene kadar orta ateşte pişirin.,4.0
74,Böğürtlenli Yoğurt,525.5,46.0,55.0,13.5,kase,0.5,0.5,gram,200,"yoğurt, böğürtlen, bal",Bir kase yoğurdun içine taze böğürtlen ve bir miktar bal ekleyip karıştırın.,5.0
75,Ceviz,35.9,0.8,0.3,3.5,adet,1.0,1.0,gram,5,ceviz,Cevizleri kabuklarından ayıklayın ve doğrudan tüketin.,5.0
76,Tavuklu Nohut Salatası,31.04,1.8,3.8,0.96,yemek kaşığı,4.0,1.0,gram,20,"tavuk göğsü, nohut, marul, domates, salatalık, zeytinyağı","Tavuk göğsünü haşlayın ve küçük parçalara ayırın. Nohutları haşlayın. Marul, domates ve salatalığı doğrayın. Tüm malzemeleri bir kaseye alın, zeytinyağı ve baharatlarla karıştırarak servis edin.",20.0
77,Etli Türlü,29.299999999999997,1.6,1.45,1.9,yemek kaşığı,4.0,1.0,gram,20,"kuzu eti, patlıcan, biber, domates, patates, soğan","Kuzu etini küp şeklinde doğrayın ve tencerede kavurun. Üzerine doğranmış soğan, biber, patlıcan, domates ve patates ekleyin. Baharatlarla tatlandırıp kısık ateşte pişirin.",20.0
78,Menemen,25.019999999999996,1.23,1.2,1.7,yemek kaşığı,4.0,1.0,gram,35,"yumurta, domates, biber, zeytinyağı","Zeytinyağında doğranmış biberleri kavurun, ardından rendelenmiş domatesleri ekleyip pişirin. Çırpılmış yumurtaları karışıma ekleyip karıştırarak pişirin.",20.0
79,Mısır Ekmeği,38.4,1.2,7.5,0.4,dilim,1.0,0.5,gram,30,"mısır unu, su, tuz, maya","Mısır ununu su, tuz ve maya ile karıştırarak hamur elde edin. Hamuru dinlendirip, önceden ısıtılmış fırında pişirin.",10.0
80,Türk Kahvesi,0.0,0.0,0.0,0.0,fincan,1.0,1.0,ml,60,"Türk kahvesi, su","Türk kahvesi ve suyu cezvede karıştırın, kısık ateşte köpürene kadar pişirin ve fincana dökün.",4.0
81,Badem,159.7,4.65,4.9,13.5,avuç,1.0,1.0,gram,30,çiğ badem,"Çiğ badem, kabukları ayıklanmış ve doğal haliyle tüketilen bademdir. Atıştırmalık olarak doğrudan yenebilir.",8.0
82,Kıymalı Kabak Dolması,91.0,6.2,6.2,4.6,adet,1.0,1.0,gram,125,"kabak, kıyma, pirinç, domates salçası, soğan, zeytinyağı","Kabakların içi oyulur ve kıyma, pirinç, soğan, salça ve baharatlarla hazırlanan harçla doldurulur. Tencereye dizilip üzerine su eklenir ve pişirilir.",10.0
83,Tavuk Şiş,105.76,15.72,1.72,4.0,adet,1.0,1.0,gram,85,"tavuk göğsü, biber, soğan, zeytinyağı, baharatlar","Tavuk göğsü küp şeklinde doğranır, biber ve soğan ile şişe dizilir. Zeytinyağı ve baharatlarla marine edilip ızgarada pişirilir.",15.0
84,Kepekli Ekmek,53.6,1.5,11.0,0.4,dilim,1.0,1.0,gram,25,"kepekli un, su, maya, tuz","Kepekli un, su, maya ve tuz karıştırılıp yoğrulur. Hamur mayalandıktan sonra şekil verilip pişirilir.",10.0
85,Kefir,104.80000000000001,5.4,6.4,6.4,su bardağı,1.0,1.0,ml,200,"süt, kefir mayası",Sütü kaynatıp soğuttuktan sonra kefir mayası ekleyin ve 24 saat bekletin.,5.0
86,Kuskus,30.8,0.98,6.0,0.32,yemek kaşığı,3.0,1.0,gram,15,"kuskus, su, tuz, zeytinyağı","Kuskusu kaynar su ve tuz ile bir tencereye koyun. Üzerine zeytinyağı ekleyin, karıştırın ve kapağını kapatıp demlenmeye bırakın. 10 dakika sonra karıştırarak servis edin.",21.0
87,Kuzu Kapama,143.5,21.0,2.5,5.5,tabak,0.5,0.5,gram,300,"kuzu eti, soğan, patates, havuç, yeşil biber, domates","Kuzu eti, soğan, patates, havuç, yeşil biber ve domates ile birlikte tencereye konur. Üzerine su eklenerek kısık ateşte pişirilir.",3.0
88,Fırında Patates,59.0,0.9,8.0,2.6,tabak,0.5,0.5,gram,110,"patates, zeytinyağı, tuz",Patatesleri yıkayıp kabuklarıyla dilimleyin. Zeytinyağı ve tuz ile karıştırıp fırın tepsisine dizin. 200°C'de 30-40 dakika pişirin.,4.0
89,Peynirli Lor Böreği,245.29999999999998,9.4,36.4,6.9,dilim,1.0,1.0,gram,145,"lor peyniri, un, süt, yumurta, tereyağı","Un, süt ve yumurta ile hazırlanan hamur, lor peyniri ile doldurularak fırında pişirilir.",6.0
90,Salatalık,6.300000000000001,0.35,1.0,0.1,adet,0.5,0.5,gram,120,salatalık,"Salatalığı yıkayın, dilimleyin ve servis edin.",3.0
91,Çay,0.0,0.0,0.0,0.0,fincan,1.0,1.0,ml,200,"su, çay yaprağı",Çay yapraklarını sıcak suya ekleyip birkaç dakika demleyin.,5.0
92,Armut,124.6,0.7,30.0,0.2,adet,1.0,1.0,gram,200,armut,"Armut yıkanır, isteğe göre kabuğu soyulur ve dilimlenerek servis edilir.",5.0
93,Izgara Köfte,49.4,4.3,1.3,3.0,adet,1.0,1.0,gram,30,"kıyma, soğan, ekmek kırıntısı, yumurta, baharatlar","Kıymayı soğan, ekmek kırıntısı, yumurta ve baharatlarla karıştırın. Karışımdan köfteler yapıp ızgarada pişirin.",10.0
94,Yumurta Kapama,124.23,6.42,0.81,10.59,adet,1.0,1.0,gram,58,"yumurta, tereyağı, baharatlar","Yumurtalar haşlanır ve soyulur. Tereyağında baharatlar kavrulur, haşlanmış yumurtalar eklenerek kısa süre pişirilir.",10.0
95,Muzlu Smoothie,181.15,6.44,31.49,3.27,su bardağı,1.0,1.0,ml,350,"muz, süt, yoğurt, bal","Muzu dilimleyin ve süt, yoğurt ve bal ile birlikte blenderda pürüzsüz hale gelene kadar karıştırın.",6.0
96,Tavuklu Sebze Güveç,55.900000000000006,3.2,2.0,3.9,yemek kaşığı,4.0,1.0,gram,30,"tavuk, kabak, patlıcan, biber, domates, soğan, sarımsak","Tavuk parçalarını ve doğranmış sebzeleri zeytinyağı ile güveçte kavurun, baharat ekleyip pişirin.",20.0
98,Etli Karnıyarık,189.12,11.1,8.73,12.2,adet,1.0,1.0,gram,345,"patlıcan, kıyma, domates, biber, soğan","Patlıcanlar uzunlamasına kesilir ve kızartılır. Kıyma, soğan ve biberle kavrulur. Patlıcanların içine kıymalı harç doldurulur ve üzerine domates dilimleri konur. Fırında pişirilir.",5.0
99,Glutensiz Ekmek,36.5,0.1,8.17,0.38,dilim,0.5,0.5,gram,30,"pirinç unu, mısır nişastası, yumurta, zeytinyağı","Pirinç unu, mısır nişastası, yumurta ve zeytinyağını karıştırarak hamur elde edin. Hamuru kalıba dökün ve önceden ısıtılmış fırında pişirin.",10.0
100,Sebzeli Tavuklu Kuskus,37.4,1.8,5.3,1.0,yemek kaşığı,3.0,1.0,gram,25,"tavuk göğsü, kuskus, biber, havuç, kabak","Tavuk göğsünü küp şeklinde doğrayın ve tavada soteleyin. Doğranmış biber, havuç ve kabak ekleyip pişirin. Ayrı bir tencerede kuskusu haşlayın ve sebzeli tavuk karışımına ekleyin. Karıştırarak servis yapın.",21.0
101,Izgara Tavuk Kanat,99.0,9.0,0.0,7.0,adet,1.0,1.0,gram,30,"tavuk kanat, zeytinyağı, tuz, karabiber","Tavuk kanatları zeytinyağı, tuz ve karabiberle marine edin. Izgarada her iki tarafını da kızarana kadar pişirin.",10.0
102,Mozzarella Peynirli Domatesli Tost,215.25,8.65,26.6,8.25,adet,1.0,1.0,gram,170,"mozzarella peyniri, domates, ekmek",Ekmek dilimlerinin arasına mozzarella peyniri ve dilimlenmiş domates koyun. Tost makinesinde peynir eriyene kadar pişirin.,5.0
103,Etli Güveç,71.4,7.4,5.5,2.2,tabak,0.5,0.5,gram,250,"kırmızı et, patates, havuç, domates, soğan","Küp doğranmış et, soğan, havuç ve patates ile birlikte güveçte pişirilir. Üzerine domates sosu eklenir ve kısık ateşte pişmeye bırakılır.",4.0
